{
  "exports_version": "1.0",
  "module_id": "__MODULE_ID__",
  "module_version": "1.0.0",
  "flows": [
    {
      "id": "__MODULE_ID__.create.public",
      "version": "1.0.0",
      "title": "创建记录",
      "description": "创建记录；使用中央范围授权与服务端项目事实。",
      "entry": {
        "kind": "capability",
        "id": "__MODULE_ID__.create",
        "version": "1.0.0"
      },
      "node_ids": [
        "__MODULE_ID__.create.business"
      ],
      "required_permissions": [
        "__MODULE_ID__.create"
      ],
      "data_access": [
        {
          "object_id": "__MODULE_ID__.record",
          "operations": [
            "create"
          ]
        }
      ]
    },
    {
      "id": "__MODULE_ID__.edit.public",
      "version": "1.0.0",
      "title": "编辑记录",
      "description": "编辑记录；使用中央范围授权与服务端项目事实。",
      "entry": {
        "kind": "capability",
        "id": "__MODULE_ID__.edit",
        "version": "1.0.0"
      },
      "node_ids": [
        "__MODULE_ID__.edit.business"
      ],
      "required_permissions": [
        "__MODULE_ID__.edit"
      ],
      "data_access": [
        {
          "object_id": "__MODULE_ID__.record",
          "operations": [
            "update"
          ]
        }
      ]
    },
    {
      "id": "__MODULE_ID__.submit.public",
      "version": "1.0.0",
      "title": "提交审核",
      "description": "提交审核；使用中央范围授权与服务端项目事实。",
      "entry": {
        "kind": "capability",
        "id": "__MODULE_ID__.submit",
        "version": "1.0.0"
      },
      "node_ids": [
        "__MODULE_ID__.submit.business"
      ],
      "required_permissions": [
        "__MODULE_ID__.submit"
      ],
      "data_access": []
    },
    {
      "id": "__MODULE_ID__.approve.public",
      "version": "1.0.0",
      "title": "审核通过",
      "description": "审核通过；使用中央范围授权与服务端项目事实。",
      "entry": {
        "kind": "capability",
        "id": "__MODULE_ID__.approve",
        "version": "1.0.0"
      },
      "node_ids": [
        "__MODULE_ID__.approve.business"
      ],
      "required_permissions": [
        "__MODULE_ID__.approve"
      ],
      "data_access": []
    },
    {
      "id": "__MODULE_ID__.read.public",
      "version": "1.0.0",
      "title": "读取记录",
      "description": "读取记录；使用中央范围授权与服务端项目事实。",
      "entry": {
        "kind": "capability",
        "id": "__MODULE_ID__.read",
        "version": "1.0.0"
      },
      "node_ids": [
        "__MODULE_ID__.read.business"
      ],
      "required_permissions": [
        "__MODULE_ID__.read"
      ],
      "data_access": [
        {
          "object_id": "__MODULE_ID__.record",
          "operations": [
            "read"
          ]
        }
      ]
    },
    {
      "id": "__MODULE_ID__.list.public",
      "version": "1.0.0",
      "title": "列出记录",
      "description": "列出记录；使用中央范围授权与服务端项目事实。",
      "entry": {
        "kind": "capability",
        "id": "__MODULE_ID__.list",
        "version": "1.0.0"
      },
      "node_ids": [
        "__MODULE_ID__.list.business"
      ],
      "required_permissions": [
        "__MODULE_ID__.read"
      ],
      "data_access": [
        {
          "object_id": "__MODULE_ID__.record",
          "operations": [
            "list"
          ]
        }
      ]
    },
    {
      "id": "__MODULE_ID__.workflow.public",
      "version": "1.0.0",
      "title": "__TITLE__",
      "description": "选择项目记录，填写并提交，由另一位具有相同范围授权的审核人办理。",
      "entry": {
        "kind": "workflow",
        "id": "__MODULE_ID__.workflow",
        "version": "1.0.0",
        "completed_states": [
          "approved"
        ]
      },
      "node_ids": [
        "__MODULE_ID__.approve.business",
        "__MODULE_ID__.create.business",
        "__MODULE_ID__.edit.business",
        "__MODULE_ID__.read.business",
        "__MODULE_ID__.submit.business"
      ],
      "required_permissions": [
        "__MODULE_ID__.read"
      ],
      "data_access": [
        {
          "object_id": "__MODULE_ID__.record",
          "operations": [
            "create",
            "read",
            "update"
          ]
        }
      ]
    }
  ]
}
